Swank Farms, Hollister, California, http://img1.10bestmedia.com/Images/Photos/333547/472_54_990x660.jpg
Summers Farm, Frederick, Maryland, http://img2.10bestmedia.com/Images/Photos/333489/Summers-Farm_54_990x660.jpg
Great Vermont, Danville, Vermont, http://img1.10bestmedia.com/Images/Photos/333492/altered-2016_54_990x660.jpg
Tom's Maze, Germantown, Ohio, http://img1.10bestmedia.com/Images/Photos/333550/unnamed-Something-To-Crow-About--2016-maze_54_990x660.jpg
Cornbelly's, Lehi, Utah, http://img1.10bestmedia.com/Images/Photos/333493/Cornbelly_54_990x660.jpg
Devine's, Harrodsburg, Kentucky, http://img2.10bestmedia.com/Images/Photos/333485/Devine-s_54_990x660.JPG
Cherry Crest Farm, Ronks, Pennsylvania, http://img1.10bestmedia.com/Images/Photos/333474/CCAF-2016-Maze-detail-LR_54_990x660.jpg
Farmstead, Meridian, Idaho, http://img1.10bestmedia.com/Images/Photos/333955/MazeDesign2016-The-Farmstead_54_990x660.jpeg
Denver Downs, Anderson, South Carolina, http://img2.10bestmedia.com/Images/Photos/333595/2014-Denver-Downs-AgPro-JD-Maze_54_990x660.JPG
Cool Spring, Mercer, Pennsylvania, http://img1.10bestmedia.com/Images/Photos/333703/Coolspring_54_990x660.jpg
